task_id,status,framework,element_types,root_causes,five_whys,db_issues,recommendations,analysis_summary
Buy_mens_nike_air_max_from_all_products__the_one_with_lowest_price__add_to_Cart_and_buy__Note__entir_2,failure,Unknown,"{""dropdown"": 7}",The task's specificity and the small database size might not accurately represent real-world scenarios or data volumes. | The UI's complexity due to the 7 dropdowns could cause usability or performance issues.,"{""Cause"": [""The task was unsuccessful (Unverified)."", ""The task might have failed due to issues with the UI or the database."", ""The UI contains 7 dropdowns, which could be overwhelming or cause performance issues, and the database has a very small dataset."", ""Too many dropdowns can clutter the interface, and the database is designed for a very specific test case."", ""The task is designed to test a specific user journey or scenario on an e-commerce website.""]}","The database name and table name are overly descriptive and cumbersome. | The database contains only one table with 9 rows, which is a very small dataset.",Simplify the UI by reducing the number of dropdowns. | Enhance the database size to better represent real-world data. | Optimize dropdown performance. | Test with different scenarios.,"The task to buy men's Nike Air Max products from an e-commerce website failed due to potential UI and database issues. The UI contains 7 dropdowns, and the database has a single table with 9 rows. Simplifying the UI, enhancing the database, and optimizing performance are recommended."
Buy_mens_nike_air_max_from_all_products__the_one_with_lowest_price__add_to_Cart_and_buy__Note__entir_5,failure,Unknown,"{""dropdown"": 28}",Insufficient UX research and testing leading to a complex UI and potentially inadequate database setup,"{""Cause"": [""Task was unverified"", ""UI or database issues prevented completion"", ""Poor design or inefficient implementation"", ""Lack of UX research or inadequate testing"", ""Tight deadlines or lack of resources""]}",Very long database and table names | Limited number of rows in the table,Simplify the UI design to reduce complexity | Populate the database with sufficient and relevant data | Conduct thorough UX research and testing,"The task failure is attributed to a combination of UI complexity and potential database insufficiencies, stemming from inadequate UX research and testing."
Buy_mens_nike_air_max_from_all_products__the_one_with_lowest_price__add_to_Cart_and_buy__Note__entir_4,success,Unknown,"{""dropdown"": 34}",Cluttered UI due to a large number of dropdown elements | Potential database design issues,"{""Cause"": [""Task is unsuccessful"", ""UI is cluttered or unresponsive"", ""Large number of dropdown elements"", ""Complex website navigation design"", ""Lack of UX research or poor design choice""]}",Single-table design | Potential data redundancy,Simplify the UI | Optimize database design,The task is unsuccessful likely due to a cluttered UI caused by 34 dropdown elements and potential issues with the database design.
Buy_mens_nike_air_max_from_all_products__the_one_with_lowest_price__add_to_Cart_and_buy__Note__entir_3,success,Unknown,"{""dropdown"": 11, ""button"": 17}",Overly complex UI with too many interactive elements | Potential issues with dropdown and button elements | Inadequate database design or naming conventions,"{""Task was unsuccessful"": [""Why1: The task involved complex interactions with multiple UI elements."", ""Why2: The UI contained 11 dropdowns and 17 buttons, potentially overwhelming the user."", ""Why3: The excessive number of interactive elements may have led to decision paralysis."", ""Why4: The UI design did not effectively prioritize or simplify the user experience."", ""Why5: The underlying framework or design principles may not have been optimized for complex tasks.""], ""Database issues"": [""Why1: The database and table names were overly descriptive and complex."", ""Why2: This complexity may have been due to a lack of standardization in naming conventions."", ""Why3: The single-table design might not have been optimal for the data being stored."", ""Why4: Without a clear schema or data sample, it's difficult to assess the database's effectiveness."", ""Why5: The database design may not have been carefully considered for the task's requirements.""]}",Overly complex naming conventions | Potential single-table design issues,Simplify the UI by reducing the number of interactive elements | Establish a clear visual hierarchy for buttons and dropdowns | Review and refactor database naming conventions and design,The task was unsuccessful due to a combination of UI complexity and potential database design issues. Simplifying the UI and improving database design are key recommendations.
Buy_mens_nike_air_max_from_all_products__the_one_with_lowest_price__add_to_Cart_and_buy__Note__entir_6,success,Unknown,{},Unknown UI Framework | Empty Element Distribution | Limited Database Size,"{""Cause"": [""Task is unverified"", ""Lack of clear success metrics or inability to execute the task"", ""Unknown UI framework and empty element distribution"", ""Complicates development and debugging, and lack of UI elements to interact with"", ""Lack of information or data about the UI's structure and elements""]}",Limited Number of Rows | Single Table Structure,Identify the UI Framework | Define UI Elements and Their Distribution | Expand Database Data,"The task's success is hindered by the unknown UI framework, lack of UI elements, and limited database data. Addressing these issues is crucial for task verification and success."
Buy_mens_nike_air_max_from_all_products__the_one_with_lowest_price__add_to_Cart_and_buy__Note__entir_1,success,Unknown,"{""dropdown"": 17, ""button"": 35}",Complexity of the task and UI | Potential lack of normalization in the database,"{""Cause"": [""The task is unsuccessful due to complexity."", ""Complexity is due to too many interactive elements and database issues."", ""Too many interactive elements and database issues are due to design priorities."", ""Design priorities favor functionality over user experience and data organization."", ""Development focuses on functionality rather than user experience or scalable data storage.""]}",Table name is excessively long and descriptive | Potential lack of normalization | Data consistency and redundancy issues,Simplify the UI | Optimize Database | Identify and leverage UI framework,"The task's complexity, coupled with a potentially overwhelming UI and a non-optimized database structure, contributes to its unsuccessful status."
Buy_mens_nike_air_max_from_all_products__the_one_with_lowest_price__add_to_Cart_and_buy__Note__entir_7,failure,Unknown,"{""dropdown"": 32}",High number of dropdown elements causing UI unresponsiveness or clutter | Inadequate database structure for the task requirements | Misunderstanding of project priorities leading to overcomplication of the UI,"{""Cause"": [""The task was unsuccessful"", ""The UI was not responsive"", ""Too many interactive elements"", ""Design did not prioritize simplicity"", ""Misunderstanding about project priorities""]}",Limited scalability with a single table | Low data volume with only 4 rows | Complex table name,Simplify the UI by reducing the number of dropdowns or optimizing their implementation | Review and adjust the database structure to better fit the task requirements | Re-evaluate project priorities with the development team to avoid overcomplication,The task failure is attributed to a complex UI with too many dropdowns and potential issues with the database structure and project priorities. Simplifying the UI and adjusting the database and project priorities are recommended.
